{
  "$schema": "http://json-schema.org/draft-07/schema#",
  "additionalProperties": false,
  "definitions": {
    "Architecture": {
      "description": "Target architecture.",
      "enum": [
        "X86",
        "X64",
        "Arm64",
        "Neutral"
      ],
      "type": "string"
    },
    "BrokerContext": {
      "additionalProperties": false,
      "description": "Broker context provided by the client.",
      "properties": {
        "ClientProcessPath": {
          "description": "File path of the client process.",
          "maxLength": 2048,
          "type": [
            "string",
            "null"
          ]
        },
        "ClientVersion": {
          "description": "Version of the UniGetUI client.",
          "maxLength": 128,
          "type": [
            "string",
            "null"
          ]
        },
        "EffectiveUser": {
          "description": "Windows identity of the calling user.",
          "maxLength": 256,
          "minLength": 1,
          "type": "string"
        },
        "RequestedElevation": {
          "allOf": [
            {
              "$ref": "#/definitions/Elevation"
            }
          ],
          "description": "Elevation level requested."
        }
      },
      "required": [
        "EffectiveUser",
        "RequestedElevation"
      ],
      "type": "object"
    },
    "Elevation": {
      "description": "Requested elevation level.",
      "enum": [
        "Standard",
        "Elevated"
      ],
      "type": "string"
    },
    "ManagerName": {
      "description": "Supported package manager names.",
      "enum": [
        "Winget",
        "PowerShell"
      ],
      "type": "string"
    },
    "Operation": {
      "description": "Package operation type.",
      "enum": [
        "Install",
        "Update",
        "Uninstall"
      ],
      "type": "string"
    },
    "PackageOperation": {
      "enum": [
        "PackageOperation"
      ],
      "type": "string"
    },
    "RequestManager": {
      "additionalProperties": false,
      "description": "Package manager metadata from the request.",
      "properties": {
        "DisplayName": {
          "description": "Human-readable display name.",
          "maxLength": 128,
          "minLength": 1,
          "type": "string"
        },
        "ExecutableFriendlyName": {
          "description": "Friendly name of the executable.",
          "maxLength": 128,
          "minLength": 1,
          "type": "string"
        },
        "Name": {
          "allOf": [
            {
              "$ref": "#/definitions/ManagerName"
            }
          ],
          "description": "Package manager name."
        }
      },
      "required": [
        "DisplayName",
        "ExecutableFriendlyName",
        "Name"
      ],
      "type": "object"
    },
    "RequestOptions": {
      "additionalProperties": false,
      "description": "Options controlling the package operation.",
      "properties": {
        "CustomInstallLocation": {
          "description": "Custom install directory path.",
          "maxLength": 2048,
          "type": [
            "string",
            "null"
          ]
        },
        "CustomParameters": {
          "description": "Additional command-line parameters.",
          "items": {
            "$ref": "#/definitions/customParameterString"
          },
          "maxItems": 64,
          "type": "array"
        },
        "Interactive": {
          "description": "Run interactively (show installer UI).",
          "type": "boolean"
        },
        "KillBeforeOperation": {
          "description": "Processes to kill before running the operation.",
          "items": {
            "$ref": "#/definitions/processName"
          },
          "maxItems": 64,
          "type": "array"
        },
        "NoUpgrade": {
          "default": false,
          "description": "Whether to skip upgrade if an existing version is detected (for install operations).",
          "type": "boolean"
        },
        "PostOperationCommand": {
          "description": "Command to execute after the package operation.",
          "maxLength": 2048,
          "type": [
            "string",
            "null"
          ]
        },
        "PreOperationCommand": {
          "description": "Command to execute before the package operation.",
          "maxLength": 2048,
          "type": [
            "string",
            "null"
          ]
        },
        "PreRelease": {
          "description": "Allow pre-release versions.",
          "type": "boolean"
        },
        "Scope": {
          "anyOf": [
            {
              "$ref": "#/definitions/Scope"
            },
            {
              "type": "null"
            }
          ],
          "description": "Installation scope."
        },
        "SkipHashCheck": {
          "description": "Skip package hash verification.",
          "type": "boolean"
        },
        "UninstallPrevious": {
          "default": false,
          "description": "Whether to uninstall previous version before installing update.",
          "type": "boolean"
        }
      },
      "required": [
        "Interactive",
        "PreRelease",
        "SkipHashCheck"
      ],
      "type": "object"
    },
    "RequestPackage": {
      "additionalProperties": false,
      "description": "Package information.",
      "properties": {
        "Architecture": {
          "anyOf": [
            {
              "$ref": "#/definitions/Architecture"
            },
            {
              "type": "null"
            }
          ],
          "description": "Target architecture."
        },
        "Channel": {
          "description": "Release channel.",
          "maxLength": 16,
          "minLength": 1,
          "type": [
            "string",
            "null"
          ]
        },
        "Id": {
          "allOf": [
            {
              "$ref": "#/definitions/packageIdentifier"
            }
          ],
          "description": "Package identifier (e.g., \"Publisher.Package\" for WinGet)."
        },
        "Name": {
          "description": "Human-readable package name.",
          "maxLength": 256,
          "minLength": 1,
          "type": "string"
        },
        "Version": {
          "anyOf": [
            {
              "$ref": "#/definitions/semanticVersion"
            },
            {
              "type": "null"
            }
          ],
          "description": "Target version (for update/install operations)."
        }
      },
      "required": [
        "Id",
        "Name"
      ],
      "type": "object"
    },
    "RequestSource": {
      "additionalProperties": false,
      "description": "Package source/repository information.",
      "properties": {
        "IsVirtualManager": {
          "description": "Whether this is a virtual manager (runs without a real CLI).",
          "type": [
            "boolean",
            "null"
          ]
        },
        "Name": {
          "description": "Source name.",
          "maxLength": 128,
          "minLength": 1,
          "type": "string"
        },
        "Url": {
          "description": "Optional source URL.",
          "maxLength": 2048,
          "type": [
            "string",
            "null"
          ]
        }
      },
      "required": [
        "Name"
      ],
      "type": "object"
    },
    "Scope": {
      "description": "Package installation scope.",
      "enum": [
        "User",
        "Machine"
      ],
      "type": "string"
    },
    "customParameterString": {
      "maxLength": 512,
      "minLength": 1,
      "type": "string"
    },
    "packageIdentifier": {
      "maxLength": 256,
      "minLength": 1,
      "pattern": "^[^\\/:*?\"<>|\\x01-\\x1f]+$",
      "type": "string"
    },
    "processName": {
      "maxLength": 128,
      "minLength": 1,
      "type": "string"
    },
    "requestSchemaUri": {
      "enum": [
        "https://aka.ms/unigetui/package-request.schema.1.0.json"
      ],
      "type": "string"
    },
    "resourceId": {
      "maxLength": 128,
      "pattern": "^[A-Za-z0-9][A-Za-z0-9._:\\-]{0,127}$",
      "type": "string"
    },
    "semanticVersion": {
      "maxLength": 128,
      "pattern": "^(0|[1-9]\\d*)\\.(0|[1-9]\\d*)\\.(0|[1-9]\\d*)(?:-((?:0|[1-9]\\d*|\\d*[A-Za-z-][0-9A-Za-z-]*)(?:\\.(?:0|[1-9]\\d*|\\d*[A-Za-z-][0-9A-Za-z-]*))*))?(?:\\+([0-9A-Za-z-]+(?:\\.[0-9A-Za-z-]+)*))?$",
      "type": "string"
    }
  },
  "description": "Canonical request sent by an unelevated UniGetUI process to the elevated broker.",
  "properties": {
    "$schema": {
      "allOf": [
        {
          "$ref": "#/definitions/requestSchemaUri"
        }
      ],
      "description": "Request schema URI constant."
    },
    "Broker": {
      "allOf": [
        {
          "$ref": "#/definitions/BrokerContext"
        }
      ],
      "description": "Broker context from the client."
    },
    "CreatedAt": {
      "description": "UTC timestamp when the client created the request (RFC 3339).",
      "format": "date-time",
      "type": "string"
    },
    "Manager": {
      "allOf": [
        {
          "$ref": "#/definitions/RequestManager"
        }
      ],
      "description": "Package manager information."
    },
    "Operation": {
      "allOf": [
        {
          "$ref": "#/definitions/Operation"
        }
      ],
      "description": "The package operation to perform."
    },
    "Options": {
      "allOf": [
        {
          "$ref": "#/definitions/RequestOptions"
        }
      ],
      "description": "Operation options."
    },
    "Package": {
      "allOf": [
        {
          "$ref": "#/definitions/RequestPackage"
        }
      ],
      "description": "Package information."
    },
    "RequestId": {
      "allOf": [
        {
          "$ref": "#/definitions/resourceId"
        }
      ],
      "description": "Unique client-generated request id for audit correlation."
    },
    "RequestType": {
      "allOf": [
        {
          "$ref": "#/definitions/PackageOperation"
        }
      ],
      "description": "Must be `\"packageOperation\"`."
    },
    "RequestVersion": {
      "allOf": [
        {
          "$ref": "#/definitions/semanticVersion"
        }
      ],
      "description": "The request syntax version (semver)."
    },
    "Source": {
      "allOf": [
        {
          "$ref": "#/definitions/RequestSource"
        }
      ],
      "description": "Source/repository information."
    }
  },
  "required": [
    "$schema",
    "Broker",
    "CreatedAt",
    "Manager",
    "Operation",
    "Options",
    "Package",
    "RequestId",
    "RequestType",
    "RequestVersion",
    "Source"
  ],
  "title": "PackageRequest",
  "type": "object"
}