{
  "$schema": "https://aka.ms/unigetui/package-request.schema.1.0.json",
  "RequestVersion": "1.0.0",
  "RequestType": "PackageOperation",
  "RequestId": "req-powershell-pester-prerelease",
  "CreatedAt": "2026-05-05T12:21:00Z",
  "Operation": "Install",
  "Manager": {
    "Name": "PowerShell",
    "DisplayName": "PowerShell",
    "ExecutableFriendlyName": "PowerShellGet"
  },
  "Source": {
    "Name": "PSGallery",
    "Url": "https://www.powershellgallery.com/api/v2",
    "IsVirtualManager": false
  },
  "Package": {
    "Id": "Pester",
    "Name": "Pester"
  },
  "Options": {
    "Scope": "User",
    "Interactive": false,
    "SkipHashCheck": false,
    "PreRelease": true,
    "CustomParameters": [],
    "KillBeforeOperation": []
  },
  "Broker": {
    "RequestedElevation": "Standard",
    "EffectiveUser": "CONTOSO\\alice",
    "ClientVersion": "3.2.0"
  }
}