{
  "$schema": "https://aka.ms/unigetui/package-request.schema.1.0.json",
  "RequestVersion": "1.0.0",
  "RequestType": "PackageOperation",
  "RequestId": "req-winget-git-custom-param-denied",
  "CreatedAt": "2026-05-05T12:18:00Z",
  "Operation": "Install",
  "Manager": {
    "Name": "Winget",
    "DisplayName": "WinGet",
    "ExecutableFriendlyName": "winget.exe"
  },
  "Source": {
    "Name": "winget",
    "Url": "https://cdn.winget.microsoft.com/cache",
    "IsVirtualManager": false
  },
  "Package": {
    "Id": "Git.Git",
    "Name": "Git",
    "Architecture": "X64"
  },
  "Options": {
    "Scope": "Machine",
    "Interactive": false,
    "SkipHashCheck": false,
    "PreRelease": false,
    "CustomParameters": [
      "--override"
    ],
    "KillBeforeOperation": []
  },
  "Broker": {
    "RequestedElevation": "Elevated",
    "EffectiveUser": "CONTOSO\\alice",
    "ClientVersion": "3.2.0"
  }
}